{
  "submission_id": "2025-04-h1-labbaseline-terra-ref",
  "robot_name": "H1-LabBaseline",
  "lab": "TERRA Reference Implementation",
  "morphology": "humanoid",
  "benchmark_version": "2.0",
  "evaluation_date": "2025-04-01",
  "build_variant": "canonical",
  "task_scores": {
    "T1": 0.956,
    "T2": 0.8716,
    "T3": 0.8576,
    "T4": 0.7707,
    "T5": 0.7068,
    "T6": 0.771,
    "T7": 0.7361,
    "T8": 0.6803
  },
  "tss": 0.7737,
  "cli": 0.7648,
  "measurement_methods": {
    "success": "robot_proprioception",
    "completion_time_s": "robot_proprioception",
    "extra_support_contacts": "robot_proprioception",
    "recovery_steps": "robot_proprioception",
    "foot_placement_error_mm": "overhead_camera",
    "energy_proxy": "robot_proprioception"
  },
  "hardware_cost_usd": 4200,
  "notes": [
    "Reference physical evaluation for TERRA v2.0 release.",
    "Unitree H1 platform with onboard stereo perception and MPC-based locomotion.",
    "Overhead camera with AprilTag36h11 calibration for foot placement; < 2 mm reprojection error verified.",
    "Energy proxy computed from motor torque x velocity integral via onboard motor controllers."
  ]
}
